{
  "schemaVersion": 1,
  "$schema": "../dapp-allowlist.schema.json",
  "name": "Euler",
  "domain": "app.euler.finance",
  "chains": {
    "ethereum": [
      {
        "address": "0x1b808f49add4b8c6b5117d9681cf7312fcf0dc1d"
      },
      {
        "address": "0x0c9a3dd6b8f28529d72d7f9ce918d493519ee383"
      },
      {
        "address": "0x000000000022d473030f116ddee9f6b43ac78ba3"
      }
    ],
    "base": [
      {
        "address": "0x5301c7dd20bd945d2013b48ed0dee3a284ca8989"
      }
    ],
    "arbitrum": [
      {
        "address": "0x6302ef0f34100cddfb5489fbcb6ee1aa95cd1066"
      }
    ],
    "avalanche": [
      {
        "address": "0xddcbe30a761edd2e19bba930a977475265f36fa1"
      }
    ],
    "linea": [
      {
        "address": "0xd8cecee9a04ea3d941a959f68fb4486f23271d09"
      }
    ]
  }
}
