{
  "schemaVersion": 1,
  "$schema": "../dapp-allowlist.schema.json",
  "name": "Owlto",
  "domain": "owlto.finance",
  "chains": {
    "bsc": [
      {
        "address": "0x872fc5fed2d1261aba4e234a47f473c9a3da2724"
      }
    ],
    "base": [
      {
        "address": "0x26637c9fdbd5ecdd76a9e21db7ea533e1b0713b6"
      },
      {
        "address": "0xb5cedaf172425bdea4c186f6fcf30b367273da19"
      },
      {
        "address": "0x89d43d991f47924dd47c9b6a7fa17c6a15091999"
      },
      {
        "address": "0x44f32c85258d66327aeac9db6cb9446b7c0fb578"
      }
    ],
    "zksync": [
      {
        "address": "0xd48e3caf0d948203434646a3f3e80f8ee18007dc"
      },
      {
        "address": "0x95cdd9632c924d2cb5586168cf0ba7640df30598"
      },
      {
        "address": "0x1da58916f20f86d661f6b08985445a3ef36ffd92"
      }
    ],
    "scroll": [
      {
        "address": "0xa5a98e1e931a26213aa5a699d2f1bfbcf63999de"
      },
      {
        "address": "0xe6feca764b7548127672c189d303eb956c3ba372"
      },
      {
        "address": "0x575dbe0023d2602515a73d4f0b5ee857e8eba805"
      },
      {
        "address": "0x716d5dd0593ca5ddf8c91a9ee40685f7525e4fc6"
      }
    ],
    "avalanche": [
      {
        "address": "0x05c4c16f7aaf68efca9b32f5e6ae260fa2c26b2c"
      }
    ],
    "arbitrum": [
      {
        "address": "0x983811d9b6bed77b36818cb58fe49d91e2d8be98"
      },
      {
        "address": "0x0e83ded9f80e1c92549615d96842f5cb64a08762"
      }
    ],
    "optimism": [
      {
        "address": "0xd9d05c8971fb0e82f3640790fb845225a6e04af9"
      },
      {
        "address": "0x0e83ded9f80e1c92549615d96842f5cb64a08762"
      }
    ],
    "linea": [
      {
        "address": "0xd7487d1ff3b2433b32e6d4c333f70a462b99f300"
      }
    ]
  }
}
