{
  "schemaVersion": 1,
  "$schema": "../dapp-allowlist.schema.json",
  "name": "Strike",
  "domain": "app.strike.org",
  "chains": {
    "ethereum": [
      {
        "address": "0x3774e825d567125988fb293e926064b6faa71dab"
      },
      {
        "address": "0xe2e17b2cbbf48211fa7eb8a875360e5e39ba2602"
      }
    ]
  }
}
