{
  "schemaVersion": 1,
  "$schema": "../dapp-allowlist.schema.json",
  "name": "Tinyworlds",
  "domain": "app.tinyworlds.io",
  "chains": {
    "bsc": [
      {
        "address": "0x96eade4c5ca5251caa7801ed38fada4807f63cbe"
      },
      {
        "address": "0x390e1ba132ed9ff3394d8aa484983cc8c85f8149"
      }
    ]
  }
}