{
  "schemaVersion": 1,
  "$schema": "../dapp-allowlist.schema.json",
  "name": "Scroll",
  "domain": "scroll.io",
  "chains": {
    "ethereum": [
      {
        "address": "0xf8b1378579659d8f7ee5f3c929c2f3e332e41fd6"
      },
      {
        "address": "0x6774bcbd5cecef1336b5300fb5186a12ddd8b367"
      }
    ],
    "scroll": [
      {
        "address": "0xe657243df50dbc60383f9504be22f7288174095c"
      },
      {
        "address": "0x7673f45e6e95373ba22651a4f5f594edec3006bc"
      },
      {
        "address": "0x7de3c253b3f28e78fa82273527b6da1f0b20c7df"
      },
      {
        "address": "0x65ab4b5f30aef8b29858ea2cbd6b0d0e68010206"
      },
      {
        "address": "0xb3faf6db995a063d020c3e4fcfbfdaa3f4e3e54e"
      },
      {
        "address": "0x5e9623b19b2ae231df659c6d88488fa21b17cc08"
      },
      {
        "address": "0xc2968d15a98406582a9fbc40c4508ce9cad4577e"
      },
      {
        "address": "0x13babb8c705506fd71f7e9aff431b9af2e659fe9"
      },
      {
        "address": "0xc47300428b6ad2c7d03bb76d05a176058b47e6b0"
      },
      {
        "address": "0x9c8a1c5b993baf52e9dd920181767b67bbd4d3a6"
      },
      {
        "address": "0x3aaa7472fb317fabc12aa0463b803d5f4f42c9f3"
      }
    ]
  }
}
