{
  "schemaVersion": 1,
  "$schema": "../dapp-allowlist.schema.json",
  "name": "Studio",
  "domain": "studio.squidrouter",
  "chains": {
    "arbitrum": [
      {
        "address": "0xce16f69375520ab01377ce7b88f5ba8c48f8d666"
      }
    ],
    "celo": [
      {
        "address": "0xce16f69375520ab01377ce7b88f5ba8c48f8d666"
      }
    ],
    "optimism": [
      {
        "address": "0xce16f69375520ab01377ce7b88f5ba8c48f8d666"
      }
    ]
  }
}
