{
  "schemaVersion": 1,
  "$schema": "../dapp-allowlist.schema.json",
  "name": "Draculafi",
  "domain": "draculafi.xyz",
  "chains": {
    "zksync": [
      {
        "address": "0x4d88434edc8b7ffe215ec598c2290cdc6f58d12d"
      },
      {
        "address": "0x1ba497d383cd7a500a8a25661598204247295a90"
      }
    ]
  }
}
